{
    "evidence_id": "example_candidate-education-001",
    "candidate_id": "example_candidate",
    "theme": "Tema fictício",
    "subtheme": "Subtema fictício",
    "evidence_level": 2,
    "neutral_summary": "Resumo exclusivamente demonstrativo revisado.",
    "original_excerpt": "Trecho fictício usado apenas para documentar o formato revisado.",
    "page": "Seção fictícia, p. 2",
    "source_file": "example-plan.pdf",
    "source_sha256": "0000000000000000000000000000000000000000000000000000000000000000",
    "target_population": "Público fictício",
    "proposed_action": "Ação fictícia para demonstração de revisão.",
    "limitations": ["Conteúdo inteiramente fictício", "Não autorizado para uso no runtime"],
    "prompt_version": "extract-evidence-v1.0.0",
    "model": "example-model",
    "generated_at": "2000-01-01T00:00:00Z",
    "review_status": "approved",
    "reviewed_at": "2000-01-02T00:00:00Z",
    "reviewer": "REVISOR FICTÍCIO DO EXEMPLO",
  "review_notes": "EXEMPLO FICTÍCIO: demonstra o formato, não comprova revisão real e não integra a matriz publicada."
}
